gate,status,evidence,repair
Circularity gate,PASS after audit,Appendix A fixes the compact kernel floor before the body application. The body begins only after inferential-life exhaustion and same-domain threat requirements are fixed.,No theorem now uses the Gödel application to define the regime it is meant to target.
Syntax-compression gate,PASS after repair,"Introduction now states that syntax, coding, and proof inscriptions matter only through same-domain readback. Section 4 adds a syntax-compression remark and a bare-syntax corollary.",Pure coding differences are explicitly classified as bookkeeping unless they alter standing or coherent trajectory structure.
Provisional-practice gate,PASS after repair,"The limits section now classifies seminar sketches, drafts, repaired proofs, and provisional codings as provisional practice until standing-bearing uptake, or else as fresh acts / explicit resets.",No-repair can no longer be misread as a ban on ordinary mathematical revision.
Scope gate,PASS after audit,"Abstract, introduction, body definitions, and limits all describe the same target: same-domain governance-relevant threat architectures inside a fixed kernel-relative regime.",No page-1 sentence now reads like a theorem about all calculi or every reasoning practice.
Gödel-specificity gate,PASS after audit,"Sections 3--6 remain application-directed: threat requirements, code-role exhaustion, no same-domain diagonalization, rescue-route exhaustion, and terminal theorem.",The body still reads as a same-domain Gödel-response paper rather than a general closure survey.
Proof-economy gate,PASS after repair,The roadmap now names the exact eight-result visible body path and keeps the audit reservoir outside the primary reader path.,Shortest body dependency path is explicit rather than hidden inside the audit-edition reserve.
